{
  "$schema": "../../../core/schema/extension.schema.json",
  "name": "custom-footer",
  "summary": "Status bar: three densities (light, default, heavy) built from prioritised segments that survive narrow terminals, showing identity, model and thinking, profile and effort tier, context headroom, live agents, and the boundary, compaction and failure warnings first. Costs are labelled measured, estimated or unknown. Also live activity, tips and a todo checklist. /footer status is the accessible detail view; /footer light|default|heavy|off|config.",
  "category": "ui",
  "tier": "T1",
  "layer": 3,
  "entry": "index.ts",
  "hooks": [
    "session_start",
    "session_shutdown",
    "agent_start",
    "message_update",
    "message_end",
    "tool_execution_start",
    "tool_execution_end",
    "turn_end",
    "agent_end",
    "model_select",
    "thinking_level_select"
  ],
  "registers": {
    "tools": [],
    "commands": [
      "/footer",
      "/tips"
    ]
  },
  "profiles": [
    "quick",
    "balanced",
    "long-horizon",
    "autonomous",
    "self-improving",
    "pentest",
    "lite"
  ],
  "enabledByDefault": true,
  "platforms": [
    "windows",
    "linux",
    "darwin"
  ],
  "runtime": {
    "nodeBuiltins": [
      "fs",
      "os",
      "path"
    ],
    "npm": [],
    "piPeers": [],
    "services": [],
    "models": []
  },
  "pulls": [],
  "env": [
    "PI_KIT_COST_INPUT_PER_MTOK",
    "PI_KIT_COST_OUTPUT_PER_MTOK",
    "PI_KIT_COST_CACHE_READ_PER_MTOK",
    "PI_KIT_COST_CACHE_WRITE_PER_MTOK",
    "PI_KIT_TIPS",
    "PI_KIT_TODO_WIDGET",
    "PI_KIT_TODO_FILE",
    "PI_KIT_ASCII",
    "PI_KIT_FIREWALL_CONFIG"
  ],
  "provenance": {
    "origin": "vendored"
  },
  "homeRepo": null,
  "status": "stable"
}
