{
  "$schema": "../../../core/schema/extension.schema.json",
  "name": "subagent",
  "summary": "Delegate tasks to specialized subagents in isolated context windows. Single, parallel (concurrency-limited, optional background) and chain ({previous} threading) modes over JSON-mode pi subprocesses that load only the extensions the delegation guard grants (the parent's protections first). Built-in kit roles are always available; roles may set model, thinking, tools, skills (preloaded) and extensions. Esc cancels children. Also runs declarative workflows (packages/kit/workflows, ~/.pi/agent/workflows, .pi/workflows): deterministic step chains with a shared run directory, parallel groups, review gates and resume.",
  "category": "planning",
  "tier": "T3",
  "layer": 4,
  "entry": "index.ts",
  "hooks": ["session_start", "session_shutdown"],
  "registers": { "tools": ["subagent", "subagent_status", "subagent_stop", "workflow_run", "workflow_status"], "commands": ["subagents", "subagent-stop", "workflow"] },
  "profiles": ["quick", "balanced", "long-horizon", "autonomous", "self-improving", "pentest", "lite"],
  "enabledByDefault": false,
  "platforms": ["windows", "linux", "darwin"],
  "runtime": {
    "nodeBuiltins": ["node:child_process", "node:fs", "node:path", "node:os", "node:url", "node:crypto"],
    "npm": [],
    "piPeers": ["typebox"],
    "services": [],
    "models": []
  },
  "pulls": [],
  "env": [
    "PI_KIT_TRUSTED_PROJECT_ROLES",
    "PI_KIT_SUBAGENT_INHERIT_MODEL",
    "PI_KIT_SUBAGENT_CONCURRENCY",
    "PI_KIT_SUBAGENT_STREAM_CAP_BYTES",
    "PI_KIT_SUBAGENT_IDLE_TIMEOUT_MS",
    "PI_KIT_SUBAGENT_MAX_RUNTIME_MS",
    "PI_KIT_SUBAGENT_HEARTBEAT_MS",
    "PI_KIT_SUBAGENT_APPROVAL_TIMEOUT_MS",
    "PI_KIT_SUBAGENT_DEPTH",
    "PI_KIT_SUBAGENT_MAX_DEPTH",
    "PI_KIT_SUBAGENT_DETACH_SIGNAL",
    "PI_KIT_SUBAGENT_STATE_DIR",
    "PI_KIT_SUBAGENT_RETRIES",
    "PI_KIT_SUBAGENT_RETRY_BACKOFF_MS",
    "PI_KIT_SUBAGENT_EXTENSIONS",
    "PI_KIT_AGENTS_DIR",
    "PI_KIT_SKILL_DIRS",
    "PI_KIT_WORKFLOWS_DIR",
    "PI_KIT_TRUSTED_WORKFLOWS"
  ],
  "provenance": { "origin": "vendored" },
  "homeRepo": "https://github.com/earendil-works/pi",
  "status": "beta"
}
