{
  "$schema": "../../../core/schema/extension.schema.json",
  "name": "recovery-orchestrator",
  "summary": "Deep root-cause recovery mode that progress-guard escalates into. On a persistent stuck signature it writes a recovery report scaffold and steers the §2 flow (fresh scouts + forked top-10 + synthesis + primary/backup plan + delegated fix) via a context-sieve contribution. Non-destructive; bounded attempts per signature; registers /recover.",
  "category": "workflow",
  "tier": "T2-T4",
  "layer": 5,
  "entry": "index.ts",
  "hooks": ["session_start", "turn_end"],
  "registers": { "tools": [], "commands": ["/recover"] },
  "profiles": ["long-horizon", "autonomous", "self-improving", "pentest"],
  "enabledByDefault": true,
  "platforms": ["windows", "linux", "darwin"],
  "runtime": {
    "nodeBuiltins": ["node:fs", "node:path"],
    "npm": [],
    "piPeers": [],
    "services": [],
    "models": []
  },
  "pulls": ["subagent", "orchestrator", "progress-guard", "verifier-board"],
  "env": ["PI_KIT_RECOVERY_MAX_ATTEMPTS", "PI_KIT_RECOVERY_SCOUTS"],
  "provenance": { "origin": "custom" },
  "homeRepo": null,
  "status": "beta"
}
